Job Title,Job_url,Company Name,Company_url,_Salary,Job_Description,Location
Data Scientist/Bioinformatician - Data Commons,https://www.indeed.com/rc/clk?jk=6667ba845e75c52a&fccid=c007936ceb766fe5&vjs=3,Mount Sinai,https://www.indeed.com/cmp/Mount-Sinai-Health-System,"$109,000 - $169,744 a year","Strength Through Diversity
Ground breaking science. Advancing medicine. Healing made personal.
Data Scientist / Bioinformatician Needed to to Lead Open Science Initiative.
A position is available for an individual with skills in data science, bioinformatics and software engineering to play the key role in running and managing the Mount Sinai Data Commons – known as the Data Ark.
The Data Ark team brings together all the most important data sets used by Sinai researchers (e.g. 1000G, GTEx, UK Biobank) in a single location on our HPC server (minvera.org), performs QA/QC processing of the data, conducts initial demographics analyses to showcase the different data sets, and will be tasked with expanding the data commons to host a large range of different data sets of different types (genotype, WES, WGS, RNA-seq, EHR-linked, imaging etc.), which will come with their own computational and platform challenges.
The Data Ark will manage, process and combine data in ways that optimize the accuracy, power and generalizability of science performed at Mount Sinai. By ensuring that Sinai investigators perform science on the same large data resource, the Data Ark should enhance collaboration and advance the pace of scientific advances made at Mount Sinai. We consider this a critical initiative for our institute and hope that it can act as a template for how open, big data science can be operationalized at an institute level. Specific job duties are outlined below.
Manage the Data Ark server space, creating an efficient file structure and providing user-access according to the specific restrictions of the different data sets
Survey the Mount Sinai community to prioritize data sets for uploading to the Data Ark
Perform quality assurance and quality control on the data sets so that they are “analysis-ready” for the vast majority of user cases
Perform demographic data analyses to showcase the characteristics of specific data sets to convey the benefits of using the different data sets
Manage the Data Ark website and its growing content
Contribute to the expansion of the Data Ark to different data types and to facilitating the linkage between different data sources (e.g. genetic, EHR etc.)
Performs other related duties as assigned
Requirements:
The post holder will have a highly quantitative, computational background and be extremely familiar with managing, processing and analyzing large complex data sets of different types.
Bachelor's in Computer Science, Science or related field
The post holder will have strong skills and experience working in a Unix-based environmental, ideally involving the management of server space, and an excellent understanding big data science, preferably having performed research projects on large complex data.
The ability to communicate clearly and present the structure and content of the data commons as it develops in the future will be critical, given the wide spectrum of investigators at Mount Sinai who will interact with the resource.
The post holder should be able to work extremely well on their own and have the initiative and vision to take the Data Ark forwards in ways that will most empower science and medical advances at Mount Sinai
.For details on the institute: http://datascience.icahn.mssm.edu
Strength Through Diversity
The Mount Sinai Health System believes that diversity, equity and inclusion are drivers for excellence. We share a common devotion to delivering exceptional patient care. Yet we’re as diverse as the city we call home- culturally, ethically, in outlook and lifestyle. When you join us, you become a part of Mount Sinai’s unrivaled record of achievement, education, and advancement as we revolutionize medicine together and participate actively as a leader within the Mount Sinai Health System by:
Serving as the primary resource management representative of the Mount Sinai leadership teams, committees, etc., and acting as the primary executive leader interface between Mount Sinai and key executives from the health systems’ vendors and partners.
Engaging with relevant thought leaders and policy-makers at the federal and state levels, and representing the Health System as assigned.
Using a lens of equity in establishing and promoting policies and procedures and providing opportunities for all to thrive.
Confronting racist, sexist or other inappropriate behavior and challenges exclusionary organizational practices and serving as a role model to promote anti-racist behaviors.
Inspiring and fostering an environment of anti-racist behaviors among and between departments and co-workers.
We work hard to acquire and retain the best people, and to create a welcoming, nurturing work environment where you can develop professionally. We share the belief that all employees, regardless of job title or expertise, can make an impact on quality patient care.
Explore more about this opportunity and how you can help us write a new chapter in our story!
Who We Are
Over 42,000 employees strong, the mission of the Mount Sinai Health System is to provide compassionate patient care with seamless coordination and to advance medicine through unrivaled education, research, and outreach in the many diverse communities we serve.
Formed in September 2013, The Mount Sinai Health System combines the excellence of the Icahn School of Medicine at Mount Sinai with seven premier hospital campuses, including Mount Sinai Beth Israel, Mount Sinai Beth Israel Brooklyn, The Mount Sinai Hospital, Mount Sinai Queens, Mount Sinai West (formerly Mount Sinai Roosevelt), Mount Sinai Morningside (formerly Mount Sinai St. Luke’s), and New York Eye and Ear Infirmary of Mount Sinai.
The Mount Sinai Health System is an equal opportunity employer. We comply with applicable Federal civil rights laws and does not discriminate, exclude, or treat people differently on the basis of race, color, national origin, age, religion, disability, sex, sexual orientation, gender identity, or gender expression.
EOE Minorities/Women/Disabled/Veterans.
Compensation
The Mount Sinai Health System (MSHS) provides a salary range to comply with the New York City Law on Salary Transparency in Job Advertisements. The salary range for the role is $109,000.00 - $169,743.92 Annually. Actual salaries depend on a variety of factors, including experience, education, and hospital need. The salary range or contractual rate listed does not include bonuses/incentive, differential pay or other forms of compensation or benefits.",
Data Scientist,https://www.indeed.com/rc/clk?jk=505ede1aa7bf7b6b&fccid=e571ceda55e25d27&vjs=3,Biz2Credit Inc,https://www.indeed.com/cmp/Biz2credit-5,"$110,000 - $130,000 a year","Description:
Biz2Credit is an online financing platform for small businesses. The company provides direct funding to small businesses across the United States. Biz2Credit is known for its financing products, educational resources for business such as the BizAnalyzer,[3] and research that it publishes periodically, including the Small Business Lending Index, and its subsidiary SaaS business lending platform Biz2X.Biz2Credit uses big data analytics, engineering, and predictive modeling to help optimize cash flow for small businesses.
Requirements:
Develop and refine Company’s decisioning and pricing model by optimizing risk and return while dramatically reducing decision cycle times.
Evaluate alternative data sources and structures to document and improve the efficacy of Company's customer conversion models and processes.
Play a leadership role in the design and implementation of ongoing operational and risk reporting and analytics.
Work on data projects and proposal involving Company’s financial services partners including banks, debtor investors, equity investors, and others to analyze, classify, and visualize credit-related data; Perform write-off forensic analysis from bank statements and other financial statements.
Classify transactions and perform risk indicator analysis and subsequently visually reporting and analysis results. From results, work to optimize forecasting model.
Develop Natural Language Processing products to classify merchant transaction data and performing risk indicator analysis and subsequently visually reporting analysis result.
Develop automated dashboards that pull, analyze and report requested metrics to both internal and external stakeholders.
Manage team of Junior Data Scientists on reporting, risk and return analysis; Work on data projects to Investors and oversee investor meetings; Advise Investors as to write-off ability and projection(s) on earnings.
Must have a Master’s Degree in Mathematics, Statistics, or a related field, plus 24 months of experience as a Data Scientist.
Please mail CVs to Biz2Credit Inc. c/o Vyckie Truong, 1 Penn Plaza, 31st Floor, New York, NY 10119 or e-mail to vyckie.truong@biz2credit.com.
Some Benefits & Perks
First class medical, dental, and vision insurance
401K, commuter benefits, and employee incentive plan
Catered lunch and team events
In the News
Names to Deloitte Technology Fast 500
Crain’s New York Fast 50x
Great Place to Work Certified",
Data Scientist - Global Decision Science,https://www.indeed.com/rc/clk?jk=736233779bed8d53&fccid=f057e04c37cca134&vjs=3,Amex,https://www.indeed.com/cmp/American-Express,"$90,000 - $165,000 a year","You Lead the Way. We’ve Got Your Back.
With the right backing, people and businesses have the power to progress in incredible ways. When you join Team Amex, you become part of a global and diverse community of colleagues with an unwavering commitment to back our customers, communities, and each other. Here, you’ll learn and grow as we help you create a career journey that’s unique and meaningful to you with benefits, programs, and flexibility that support you personally and professionally.
At American Express, you’ll be recognized for your contributions, leadership, and impact—every colleague has the opportunity to share in the company’s success. Together, we’ll win as a team, striving to uphold our company values and powerful backing promise to provide the world’s best customer experience every day. And we’ll do it with the utmost integrity, and in an environment where everyone is seen, heard and feels like they belong.
Join Team Amex and let's lead the way together
As a brand built on going above and beyond to provide the best customer experience, having the most exceptional colleagues is paramount. As the face of the company, you can create positive interactions with our customers every day–from curating a unique travel or lifestyle experience to helping them with their everyday needs. And you can grow your skills through industry-leading training and ongoing coaching, all while learning what it means to continually set the standard for world class, customer-first service.
Decision Science colleagues will serve as a key member of the Credit and Fraud Risk organization. We seek a thought-leader and a problem-solver who can blend business, technical, and industry best practices when it comes to developing the analyses, models, and algorithms that power our customers’ digital experiences.
This critical team is responsible for managing enterprise risks throughout the customer lifecycle, across our consumer and commercial businesses, and across all our global products. We develop industry-first data capabilities, build profitable decision-making frameworks, create machine learning-powered predictive models, and improve customer servicing strategies.
Our Decision Science teams use industry leading modeling and AI practices to predict customer behavior. We develop, deploy and validate predictive models and support the use of models in economic logic to enable profitable decisions across credit, fraud, marketing and servicing optimization engines.
The role will entail some of the below listed responsibilities:
Work with massive amounts of digital data (Web, App, API) and sophisticated tools in an industry leading Big Data environment.
Build NLP driven solutions from identifying business problems, to collecting training dataset, to analyzing data, to modeling, to validating and to delivering NLP models
Build everything from basic reports to advanced machine learning models and algos to drive improvements to our customer’s online and mobile app experiences.
Work with product owners to revolutionize the product and content design with a data-driven approach
Collaborate with tech partners to test, implement and deploy modeling solutions to production system.
Develop insights into customer behavior and introduce new approaches to transform complex behavioral data into actionable information
Leverage the power of closed loop through Amex network to make decisions more intelligent and relevant
Innovate with a focus on developing newer and better approaches using big data & machine learning solutions
Qualifications:
Masters/PhDs in a quantitative field (Computer Science, Statistics, Mathematics, Physics, Operation Research and etc.) with hands-on experience leveraging sophisticated analytical and machine learning techniques. PhD degree with practical experiences NLP is a significant plus.
Expertise in an analytical language (Python, R or the equivalent), and experience with databases (Hive, SQL, or the equivalent). Knowledge of SAS is a plus but not required.
Deep understanding of machine learning/statistical algorithms such as deep learning and boosting. Experience with data visualization is a plus
Demonstrated ability to frame business problems into mathematical programming problems, leverage external thinking and tools (from academia and/or other industries) to engineer a solution and deliver business insights.
Ability to work effectively in a team environment
Independent thinker who’s organized, has great attention to detail, and can multi-task
Strong communication skills
Ability to learn quickly and work independently with sophisticated, unstructured initiatives
Ability to integrate with cross-functional business partners worldwide
Proficient in presentation tools, including Excel and PowerPoint
Salary Range: $90,000.00 to $165,000.00 annually + bonus + benefits
The above represents the expected salary range for this job requisition. Ultimately, in determining your pay, we'll consider your location, experience, and other job-related factors.
American Express is an equal opportunity employer and makes employment decisions without regard to race, color, religion, sex, sexual orientation, gender identity, national origin, veteran status, disability status, age, or any other status protected by law.
We back our colleagues with the support they need to thrive, professionally and personally. That's why we have Amex Flex, our enterprise working model that provides greater flexibility to colleagues while ensuring we preserve the important aspects of our unique in-person culture. Depending on role and business needs, colleagues will either work onsite, in a hybrid model (combination of in-office and virtual days) or fully virtually.
US Job Seekers/Employees - Click here to view the “EEO is the Law” poster and supplement and the Pay Transparency Policy Statement.
If the links do not work, please copy and paste the following URLs in a new browser window: https://www.dol.gov/agencies/ofccp/posters to access the three posters.
Depending on factors such as business unit requirements, the nature of the position, cost and applicable laws, American Express may provide visa sponsorship for certain positions.",
Data Scientist,https://www.indeed.com/rc/clk?jk=92aaa83df4ecc9d9&fccid=be3b11aa573faee7&vjs=3,CVS Health,https://www.indeed.com/cmp/CVS-Health,,"Aetna Resources LLC, a CVS Health company, is hiring for the following role in New York, NY: Data Scientist to Formulate and apply mathematical and computational modeling methods towards data extraction and manipulation. Duties include: design and develop data solutions using industry leading tools, technologies and best practices to profile data and develop efficient ingestion by sourcing data from PBM, Specialty, Retail, and/or HealthCare business; develop advanced algorithms and statistical predictive models to evaluate scenarios and provide usable information on health metrics and potential future outcomes; extract and manipulate data from multiple large data sources and deliver predictive models that inform solutions for in-house teams (i.e. pharmacy pricing, medical costs, risk scores, onboarding) and customer engagement across critical journeys (i.e. calories, heart rate, breast cancer, maternity); utilize strong programming skills to explore, analyze, and interpret large volumes of data in various forms and solve complex business problems; support deployment of insights across multiple channels and work on mathematical analysis methods, machine learning, and statistical analyses. Multiple positions.
Required Qualifications
Master’s degree (or foreign equivalent) in Computer Science, Data Science, Statistics, Mathematics, Business Analytics, or a related field and two (2) years of experience in each of the following: analyzing large data sets from multiple data sources; R, Python, SAS, or SQL programming languages; and visualization tools, including PowerBI or Tableau.
Preferred Qualifications
See Required Qualifications.
Education
See Required Qualifications.
Business Overview
Bring your heart to CVS Health Every one of us at CVS Health shares a single, clear purpose: Bringing our heart to every moment of your health. This purpose guides our commitment to deliver enhanced human-centric health care for a rapidly changing world. Anchored in our brand — with heart at its center — our purpose sends a personal message that how we deliver our services is just as important as what we deliver. Our Heart At Work Behaviors™ support this purpose. We want everyone who works at CVS Health to feel empowered by the role they play in transforming our culture and accelerating our ability to innovate and deliver solutions to make health care more personal, convenient and affordable. We strive to promote and sustain a culture of diversity, inclusion and belonging every day. CVS Health is an affirmative action employer, and is an equal opportunity employer, as are the physician-owned businesses for which CVS Health provides management services. We do not discriminate in recruiting, hiring, promotion, or any other personnel action based on race, ethnicity, color, national origin, sex/gender, sexual orientation, gender identity or expression, religion, age, disability, protected veteran status, or any other characteristic protected by applicable federal, state, or local law. We proudly support and encourage people with military experience (active, veterans, reservists and National Guard) as well as military spouses to apply for CVS Health job opportunities.",
"Data Science Mng, Marketing Analytics",https://www.indeed.com/rc/clk?jk=f66d2825f1b987a1&fccid=978d9fd9799d55a8&vjs=3,PayPal,https://www.indeed.com/cmp/Paypal,"$84,500 - $204,600 a year","At PayPal (NASDAQ: PYPL), we believe that every person has the right to participate fully in the global economy. Our mission is to democratize financial services to ensure that everyone, regardless of background or economic standing, has access to affordable, convenient, and secure products and services to take control of their financial lives.
Job Description Summary: Our Marketing Analytics transformation is in full swing. We embarked on a path of transforming and building a world class Marketing Analytics Org recently. Our team helps to power PayPal’s high growth Marketing organization by delivering actionable insights and business intelligence to Consumer Marketing Org for our 200+ million customers.
Job Description:
In this role, you will lead a workstream solutions for complex, ambiguous and high-visibility business challenges. You will set and execute on a vision that reflects your deep analytical expertise. You will be a thought partner to Marketing leadership teams.
You will partner with these teams to understand the insights they require to manage and grow their business and leverage cross-functional teams to develop and land solutions that meet their needs at scale. You are deeply curious and persistent in gaining knowledge about our products and go-to-market strategy.
You will have exposure and visibility to PayPal Sales, Product, Finance & Market Insights teams, as you work with them to create a holistic solution to Marketing problems. We are a team of entrepreneurial, enthusiastic, and client-focused members.
If you are a fast learner, are willing to learn and grow, have a can-do attitude, and wants to solve problems in the most pragmatic way
You are curious and inquisitive: love digging into data and uncovering insights
You are hyper-analytical and intellectually honest, truly believing in data-driven decisions and communicating your ideas through storytelling
You are familiar with data science and machine learning techniques to improve product experiences
You are a highly motivated, result-oriented self-starter, enjoy working in a fast-paced environment, and can deliver successful results with minimal guidance
You are a fun-loving, adventurous team player; we would like to talk with you.
PayPal is committed to fair and equitable compensation practices.
Actual Compensation is based on various factors including but not limited to work location, and relevant skills and experience.
The total compensation for this practice may include an annual performance bonus (or other incentive compensation, as applicable), equity, and medical, dental, vision, and other benefits. For more information, visit https://www.paypalbenefits.com.
The U.S. national annual pay range for this role is $84500 to $204600
Our Benefits:
At PayPal, we’re committed to building an equitable and inclusive global economy. And we can’t do this without our most important asset—you. That’s why we offer benefits to help you thrive in every stage of life. We champion your financial, physical, and mental health by offering valuable benefits and resources to help you care for the whole you.
We have great benefits including a flexible work environment, employee shares options, health and life insurance and more. To learn more about our benefits please visit https://www.paypalbenefits.com
Who We Are:
To learn more about our culture and community visit https://about.pypl.com/who-we-are/default.aspx
PayPal has remained at the forefront of the digital payment revolution for more than 20 years. By leveraging technology to make financial services and commerce more convenient, affordable, and secure, the PayPal platform is empowering more than 400 million consumers and merchants in more than 200 markets to join and thrive in the global economy. For more information, visit paypal.com.
PayPal provides equal employment opportunity (EEO) to all persons regardless of age, color, national origin, citizenship status, physical or mental disability, race, religion, creed, gender, sex, pregnancy, sexual orientation, gender identity and/or expression, genetic information, marital status, status with regard to public assistance, veteran status, or any other characteristic protected by federal, state or local law. In addition, PayPal will provide reasonable accommodations for qualified individuals with disabilities. If you are unable to submit an application because of incompatible assistive technology or a disability, please contact us at paypalglobaltalentacquisition@paypal.com.
As part of PayPal’s commitment to employees’ health and safety, we have established in-office Covid-19 protocols and requirements, based on expert guidance. Depending on location, this might include a Covid-19 vaccination requirement for any employee whose role requires them to work onsite. Employees may request reasonable accommodation based on a medical condition or religious belief that prevents them from being vaccinated.",
