Job Title,Job_url,Company Name,Company_url,_Salary,Job_Description,Location
Statisticians,https://www.indeed.com/rc/clk?jk=f3ae58372a1468b2&fccid=f88a85f7300e8af3&vjs=3,,,,"About Us:
The Grand Pacific CRO team has over 25 years’ experience in conducting clinical trials in the Asia Pacific region, including Australia, New Zealand and South Africa. We have continued as a leader in the industry and have expanded services to include central laboratory, site management and image reading services. We pride ourselves on meeting customers where they are and providing exactly what they need to move their products forward.
Job Summary:
Responsible for all statistical aspects of clinical studies and submissions, including quality, relevance to regulatory requirements, and scientific validity. Providing statistical expertise and consultant on projects.
Responsibility:
Scientifically valid statistical analysis of clinical trial data
Statistical contribution to clinical study protocols
Provide sample size calculations
Generate randomization schedules
Statistical review of case report forms (CRFs) or electronic Case Report Forms (eCRF)
Develop Statistical Analysis Plans (SAP) including table, listing, and figure (TLF) shells
Generate analysis datasets, tables, figures, and listings to support the analysis of clinical trials data using SAS.
Provide quality control for statistical based SAS programs and other study documents (e.g., presentations and reports).
Provide programming support to supplemental or exploratory analyses for regulatory agencies or any other internal and external ad-hoc requests
Provide statistical consulting tasks
Provide output review across programs to ensure consistency.
Provide statistical analysis and reports
Review statistical sections of clinical study reports
Work directly with sponsors, project managers, and external vendors on statistics-related project components
Learning and applying advanced statistical techniques
Delivery:
Study design and sample size
Statistical contribution to clinical study protocols
Statistical review of electronic Case Report Forms (eCRF)
Statistical Analysis Plans (SAP)
Table, listing, and figure (TLF) shells
Statistical analysis results and reports
Qualifications:
Bachelor’s degree in statistics
Postgraduate degree or equivalent in statistics, biostatistics, mathematics, medical field, or related education
Technical knowledge & skills or other requirements:
Knowledge and understanding of advanced statistical concepts and techniques.
Experience with SAS or R programming.
Knowledge of clinical trial methodology.
Understanding of the regulatory drug submission / approval process regionally and globally.
Strong written and verbal communication skills in English.
Excellent organizational skills, time management, and ability to coordinate workload and meet established deadlines.
Excellent communication and interpersonal skills to effectively interface with others.
Work experience:
Minimum of 3 years overall work experience; 2+ years of relevant experience in a scientific, medical, or clinical research field.
Demonstrated analytical skills.
Experienced in supporting the analysis of clinical trial data.
Familiarity with clinical trial protocols and reports desirable.
Ability to work on results and protocols from multiple therapeutic areas.
Pharmaceutical or CRO experience or other experience with clinical trials or biomedical research
Strong communication skills.",
10101 - Sr. Survey Data Analyst,https://www.indeed.com/rc/clk?jk=4319d87d61d4da6d&fccid=c6b5143eab3dbe34&vjs=3,The Fund for Public Health in New York City,https://www.indeed.com/cmp/Fund-For-Public-Health-in-New-York-Inc,"$95,138 - $97,138 a year","Salary range is $95,138 - $97,138
Generous Paid Time Off (PTO) policy
Medical, dental, and life insurance with low or no employee contribution
A retirement savings plan with generous employer contribution
Flexible spending medical and commuter benefits plan
Generous and flexible work from home policy with up to three days working at home
Fun hybrid office environment and passionate team
Fun all staff events all year round
Meaningful work at an organization striving to advance health equity and social justice",
"Full Stack Engineer, Machine Learning",https://www.indeed.com/rc/clk?jk=f260c92bae61ad92&fccid=8899ecbdba2d0a5e&vjs=3,Peloton,https://www.indeed.com/cmp/Peloton,,"ABOUT THE ROLE
The AI Platform team at Peloton is looking for a full stack engineer to build an interactive data management web application that allows teams to access, label and QA training data for all our computer vision tasks. In this role you will work closely with other software engineers, data managers and Machine Learning engineers to understand the client needs and build features that support all aspects of the data management lifecycle necessary for ML tasks. They will have a unique opportunity to build applications that manage one of the largest fitness related datasets that drives the ML development of our current as well as future connected platforms at Peloton. We're looking for someone who's excited about the challenges of data management at scale that defines the future of connected fitness.
To be successful you will need a combination of problem-solving, technical, and communication skills, as well as the ability to handle a mix of disparate tasks which will include project and software development work.
YOUR DAILY IMPACT AT PELOTON
Integrate vendor applications that allows teams to QA and label data for ML training needs.
Develop new client-facing features that support data management lifecycle.
Promote constant refactoring, pair programming, iterative development, and other industry best practices such as CI/CD, test automation, logging, and monitoring in order to ensure confidence in our release process.
Write understandable, well tested code and libraries with an eye towards maintainability and scalability.
Active engagement in technical discussions during architecture meetings, code reviews, and task breakdown.
Help to evolve our system, organically without over-engineering, promoting simplicity and working software.
YOU BRING TO PELOTON
2+ years of experience with Python and JavaScript/Django and a strong programming background (currently not accepting new graduates for this position).
2+ years of experience with common AWS technologies like SQS, S3, MWAA etc.
Experience with developing and deploying containerized microservices into cloud environments.
Understanding test driven development and experience with Jenkins in building out CI/CD pipelines.
Interested in picking up new tools/technologies required for development.
Capacity to work in high growth, fast-paced environments, and can adapt to change.
#LI-Hybrid
#LI-JS2
ABOUT PELOTON:
Peloton is the leading interactive fitness platform globally, with a passionate community of nearly 7 million Members in the US, UK, Canada, Germany, and Australia. Peloton makes fitness entertaining, approachable, effective, and convenient, while fostering social connections that motivate its Members to commit to their fitness journeys. An innovator at the nexus of fitness, technology, and media, Peloton reinvented the fitness industry by developing a first-of-its-kind subscription platform that seamlessly combines the best equipment, proprietary networked software, world-class streaming digital fitness and wellness content, and best-in-class fitness experts and Instructors.
Peloton is an equal opportunity employer and committed to creating an inclusive environment for all of our applicants. We do not discriminate based upon race, religion, color, national origin, gender (including pregnancy, childbirth, or related medical conditions), sexual orientation, gender identity, gender expression, age, status as a protected veteran, status as an individual with a disability, or other applicable legally protected characteristics. If you would like to request any accommodations from application through to interview, please email: applicantaccommodations@onepeloton.com
Please be aware that fictitious job openings, consulting engagements, solicitations, or employment offers may be circulated on the Internet in an attempt to obtain privileged information, or to induce you to pay a fee for services related to recruitment or training. Peloton does NOT charge any application, processing, or training fee at any stage of the recruitment or hiring process. All genuine job openings will be posted here on our careers page and all communications from the Peloton recruiting team and/or hiring managers will be from an @onepeloton.com email address.
If you have any doubts about the authenticity of an email, letter or telephone communication purportedly from, for, or on behalf of Peloton, please email applicantaccommodations@onepeloton.com before taking any further action in relation to the correspondence.
Peloton does not accept unsolicited agency resumes. Agencies should not forward resumes to our jobs alias, Peloton employees or any other organization location. Peloton is not responsible for any agency fees related to unsolicited resumes.",
Data Science Lead – Digital Underwriting,https://www.indeed.com/rc/clk?jk=e50fb3afd6177f38&fccid=d4448c192a012f32&vjs=3,Munich Re America,https://www.indeed.com/cmp/Munich-Re,"$188,300 - $276,200 a year","Data Science Lead – Digital Underwriting
Location
New York , United States
Your job
We’re adding to our diverse team of experts and are looking to hire those who are committed to building a culture that enables the creation of innovative solutions for our business units and clients.
The Insurance Operations
Munich Re Specialty Insurance (MRSI) provides extensive, specialty property and casualty insurance solutions to customers through select brokers, Managing General Agents, program administrators, cover holders and insurtech partners. Products include: property, casualty, professional liability and other specialty insurance solutions. Our comprehensive, customized solutions are provided by A+ rated carriers and are tailored to clients’ needs. We offer superior service levels, industry-recognized underwriting and claims expertise and innovative approaches to complex and evolving risks.
Munich Re Specialty Insurance (MRSI) is a description for the insurance business operations of affiliated companies in the Munich Re Group that share a common directive to offer and deliver specialty property and casualty insurance products and services in North America. For more information on MRSI, including licensing, regulatory-required, and other information on the operating companies, visit https://www.munichre.com/us-non-life/en/general/munich-re-specialty-insurance-disclosures.html.
The Opportunity
Future focused and always one step ahead
Digital Underwriting is a strategic innovation initiative of Munich Re Specialty Insurance (MRSI) which provides advanced portfolio acquisition and steering capabilities through embedded data science, underwriting, actuarial, software and data engineering resources. The current scope of Digital Underwriting consists of surplus-lines personal and commercial property casualty business sourced from national wholesalers using rules-based straight-through processing API workflows.
The core mission of the team is to rethink underwriting and create next generation underwriting engines that enable digitized business flows within MRSI’s active business units. Combining traditional actuarial science with data-centricity through scaled modern-architecture automation and machine learning, Digital Underwriting uses analytical models to accelerate and optimize the efficiency and precision of single risk underwriting combined with portfolio pricing and management. This role provides a unique opportunity to create/serve machine learning models (via APIs) to build and further enhance the core of an innovative digital underwriting product.
We are seeking an experienced and solution-oriented data scientist to lead our high-performing Data Science team in New York, NY and Munich, Germany. As Data Science Lead you will be responsible for setting and achieving the objectives, roadmap, workflow and deliverables of team. You will lead the team and direct activities to acquire and manage disparate sets of proprietary historical premium and loss, ISO and third-party data to develop actionable insights to demonstrably improve risk selection and pricing in production environments for target business segments. You will use a wide array of techniques to architect and implement complex advanced-level models which deliver business. You will operate within a highly collaborative culture and leadership team, so expect to work closely with multi-disciplinary experts including underwriting, actuarial, product management, software engineer, and data engineer colleagues to deliver a cohesive, data-focused product. You will champion MRSI’s data-driven and automated decision models with external clients, including business executives and technical leads toto support the product and technical roadmap for Digital Underwriting.
Your Job:
Take ownership and lead the Data Science team, setting objectives and managing task prioritization, cadence, and project deliverables to:
Develop complex decision models which enhance and optimize selection and pricing to deliver economic benefit to risk-based decisions
Develop and enhance loss cost models (product pricing)
Automate machine learning model pipelines (ETL through model delivery) with production ready rigor
Deliver insights from data with advanced analytic models and visualization tools
Evaluate third party data and design production risk models which measurably improve selection and pricing
Develop robust and reporting tools to create visually meaningful business reporting for internal and external stakeholders
Continuously collaborate with other MRSI colleagues and functional leads to innovate and build Digital Underwriting’s data-centric capabilities and value proposition
Works on advanced, complex technical projects or business issues requiring state of the art technical or industry knowledge
Your profile
Requirements:
Bachelor Degree Required, Master/PHD Preferrred in quantitative or statistical discipline
8+ years of work experience as a Senior-level Data Scientist (insurance/reinsurance industry preferred)
8+ years coding with an object-oriented programming language
Ability to conceptualize and render complex machine analytic and learning models from development, testing and production stages through Agile development process
Experience and demonstrated ability to design complex decision models and lead data science team through development and delivery to production
Demonstrated ability to prioritize and lead teamwork effort to achieve timely delivery or project milestones through multiple and conflicting objectives
Ability to articulate the economic benefit of quantitative models to non-quantitative colleagues, clients and stakeholders
Ability to effectively lead and motivate quantitatively oriented staff
Experience serving machine learning models via an API
Proficient in Python and SQL
The Company is open to considering candidates in numerous locations, including NYC. The salary range posted below applies to the Company’s NYC location.
The base salary range anticipated for this position is $188,300-276,200, plus opportunity for company bonus based upon a percentage of eligible pay. In addition, the company makes available a variety of benefits to employees, including health insurance coverage, an employee wellness program, life and disability insurance, 401k match, retirement savings plan, paid holidays and paid time off (PTO).
The salary estimate displayed represents the typical salary range for candidates hired in this position in NYC. Factors that may be used to determine your actual salary include your specific skills, how many years of experience you have and comparison to other employees already in this role. Most candidates will start in the bottom half of the range.
At Munich Re US, we see Diversity and Inclusion as a solution to the challenges and opportunities all around us. Our goal is to foster an inclusive culture and build a workforce that reflects the customers we serve and the communities in which we live and work. We strive to provide a workplace where all of our colleagues feel respected, valued and empowered to achieve their very best every day. We recruit and develop talent with a focus on providing our customers the most innovative products and services.
We are an equal opportunity employer. Reasonable accommodations may be made to enable individuals with disabilities to perform the essential functions.
About us
Founded in 1917, Munich Reinsurance America, Inc. is one of the largest reinsurers in the United States. Munich Reinsurance America, Inc. has earned the A+ (Superior) financial strength rating from A.M. Best Company - that's among the highest in the industry. Over 1,000 employees serve our clients from our Princeton, New Jersey campus and regional offices throughout the United States.
As a member of Munich Re's US operations, we offer the financial strength and stability that comes with being part of the world's preeminent insurance and reinsurance brand. Our risk experts work together to assemble the right mix of products and services to help you stay competitive - from traditional reinsurance coverages, to niche and specialty reinsurance and insurance products.
Apply now!
Apply for this Job!",
"Data Scientist, Rapid Response",https://www.indeed.com/rc/clk?jk=191dd6d688626090&fccid=ad54f07d33b76482&vjs=3,Gro Intelligence,https://www.indeed.com/cmp/Gro-Intelligence,,,
Statisticians,https://www.indeed.com/rc/clk?jk=f3ae58372a1468b2&fccid=f88a85f7300e8af3&vjs=3,,,,,
"Senior Advisor, Data Science (REMOTE)",https://www.indeed.com/rc/clk?jk=326985f96c86c107&fccid=6f31e2074a3d8a7b&vjs=3,Northwell Health,https://www.indeed.com/cmp/Northwell-Health,"$140,100 - $245,200 a year","Job Description
Job Description
Responsible for implementing applications and homegrown solution projects, as well as maintaining and evolving its framework. Works closely with Business Intelligence and Software Engineer teams while indirectly overseeing those needing guidance to solve challenging problems with the use of Natural Language Processing (NLP). Advises on how best to execute techniques in order to achieve the desired outcomes for both department and enterprise level projects and initiatives.
Job Responsibility
1.Serve as subject matter expert in NLP techniques such as word embeddings (word2vec, fasttext, Transformers), topic modeling (LSA/LSI, LDA, NMF), search, dialogue systems (Rasa, kore.ai), knowledge graphs.
2.Apply machine learning algorithms such as dimensionality reduction, decision trees, random forest, gradient boosted trees, logistic regression, DBSCAN, K-means, hierarchical clustering, and deep learning in order to solve challenging business problems.
3.Responsible for leading implementation of Northwell homegrown solution projects, as well as develop concepts that Northwell's online application will use for named entity recognition, semantic search, sentiment analysis, text summarizations, machine translations and auto entity abstraction for registry submissions.
4.Works independently to build and maintain the framework that Northwell's online application will leverage in order to provide this type of service to their user base, devising new methods and procedures as necessary based on the competing market space.
5.Oversees the evolution of the framework and makes recommendations to management to ensure modern techniques are implemented as they become available in the market place.
6.Often operates in ambiguous situations and provides technical and functional guiance to others on problems of diverse scope and complexity, using independent judgment requiring analysis of variable factors.
7.Advanced knowledge may exceed that of management; frequently serves as technical advisor to both leadership and supporting work teams.
8.Works on programs to oversee and apply knowledge of data science methodologies, including predictive modeling and machine learning, data analytics and visualization, and usability and design, to departmental, service line, and enterprise applications and functions.
9.Works with senior leadership to determine best methods, techniques, and analytical approaches on matters of significance.
10.Oversees and provides guidance to senior professionals when synthesizing complex data-related problems into actionable business/clinical strategy based on subject matter expertise.
11.Lead the development of specifications to support the design of new or modified data science projects, with a focus on data-driven optimization, enhancement, and development.
12.Works independently at the most advanced level to evaluate projects, systems, and initiatives at the department, service line, and enterprise level.
13.Monitors projects and their outputs to ensure they enhance clinical quality, patient safety, and institutional efficiency, focusing on all aspects of data science, including data gathering and wrangling, exploratory data analysis, data modeling and machine learning, and model implementation and evaluation. Ensures high quality execution of all proposed projects.
14.Applies subject matter expertise to present and planned data science projects and maintains voice of the customer in all project initiatives.
15.Serves as the project lead and link between the clinical staff (customer) requirements and technical capabilities on both short and long term projects. Majority of contact is with stakeholders across the system as the subject matter expert.
16.Ensures that systems are implemented to support Health System initiatives and goals to improve the quality of patient care, to maximize patient safety, and to provide operational efficiency.
17.Deep understanding of statistical and predictive modeling concepts, makes recommendations for machine-learning approaches, clustering and classification techniques, and optimization algorithms.
18.Identifies opportunities and moves projects involving NLP solutions from concepts to production using multi-modal and multilingual contexts.
19.Performs related duties as required. All responsibilities notes here are considered essential functions of the job under the Americans with Disabilities Act. Duties not mentioned here, but considered related are not essential functions.
Job Qualification
Bachelor’s Degree in Computer Science, Informatics, Statistics, Engineering, Data Science, Computational Linguistics or related field, required.
Master’s Degree or equivalent combination of education and related experience, preferred.
Minimum of ten (10) years of experience involving quantitative data analysis, data science, and machine learning, preferred.
Minimum of two (2) years of experience in one or more of the following domains: Natural Language Processing (NLP), Natural Language Understanding (NLU), Natural Language Generation (NLG), Automatic Speech Recognition (ASR), Human-Computer Interaction (HCI), preferred.
HIGHLY PREFERRED:
experience with Healthcare Data
*Additional Salary Detail
The salary range and/or hourly rate listed is a good faith determination of potential base compensation that may be offered to a successful applicant for this position at the time of this job advertisement and may be modified in the future. When determining a team member's base salary and/or rate, several factors may be considered as applicable (e.g., location, specialty, service line, years of relevant experience, education, credentials, negotiated contracts, budget and internal equity).",
