Job Title,Job_url,Company Name,Company_url,_Salary,Job_Description,Location
Sr Data Analyst,https://www.indeed.com/rc/clk?jk=4906c44b193efb14&fccid=9e477371fd2b364d&vjs=3,"National CineMedia, LLC",https://www.indeed.com/cmp/National-Cinemedia,"$65,000 - $75,000 a year","ABOUT NCM:
We are the country’s largest, most innovative movie theater network whose mission is to unite brands with our young, diverse audience through the power of movies and pop culture. Over 600 million moviegoers watch our preshow Noovie each year giving us incredible reach with unrivaled engagement, making our network a premium destination for advertisers. We’re a dynamic, fast-moving company focused on enhancing the moviegoing experience while developing creative ways for brands to talk to our hard-to-reach audience.
We’re committed to diversity, inclusion, and belonging, and strive to create a culture that leans into innovation, collaboration, accountability, honor, and perseverance. We’re obsessed with the movies, client solutions, and whistling while we work. If that sounds like a great sequel to your career’s story, check us out at NCM.com/careers.
POSITION SUMMARY:
Collect and analyze data to identify trends and insights and provide internal or external stakeholders with analysis that can be used for sales prospecting, marketing collateral, advertising product or to demonstrate client ROI. The main duties include identifying, gathering, analyzing data and making the insights accessible to the stakeholders through easy-to-understand graphs, charts, tables and reports. Collaborate with sales and marketing groups on the creation and execution of sales presentations. The ideal candidate will be a data-analytics expert who works across cross functional teams to identify and build targeting, measurement and advertising effectiveness solutions that drive business growth for NCM and its vast array of clients across the portfolio. Own project management activities for the monthly reporting process, including QA and coordination of reporting streams with technical teams. The Sr Data Analyst will have experience with top to bottom analytics; not just pulling the data, but also translating business goals to measure KPIs, data layers, QA and translating results to internal/external stakeholders.
ESSENTIAL FUNCTIONS: Essential duties and responsibilities may include, but are not limited to, the following:
Synthesize data from multiple datasets in AWS using SQL to power automated dashboards for sales and marketing teams
Proactively uncover key trends, opportunities, and sales opportunities in terms of category of interests to help with revenue growth
Experience in customer journey, attribution, conversion analysis and geofenced datasets (FourSquare, PlaceIQ etc.)
Develop a deep understanding of movie-goer and DOOH audiences' behaviors throughout their lifetime and their correlation with retention and growth (LTV)
Design, optimize and execute (primarily via data visualization tools) on standard cadence of operations to deliver actionable audience insights (e.g., weekly reporting, monthly and quarterly review)
Deliver adhoc analysis and data pulls to multiple internal customers including Sales, Marketing, and Executive teams
Translate business goals to measure KPIs, data layers, QA and translating results to internal/external stakeholders.
QUALIFICATIONS:
BA/BS in marketing, statistics, mathematics, economics or other quantitative discipline
3-5 years of experience with large data sets and analytical tools
Knowledge of SQL
Advanced Power BI, Tableau, Domo, or equivalent report building experience
Knowledge of additional scripting language(s) (Python, R, etc.)
Strong curiosity, leadership and business acumen
Experience in or knowledge of Media Analytics platforms preferred
Experience with working with SalesforceSQL, and audience targeting platforms (e.g. DMP’s, CDP’s) preferred
Strong interpersonal skills with the ability to motivate, collaborate and influence
Flexible and adaptable
Ability to deliver on multiple projects and meet tight deadlines
Ability to be persuasive, influence, and execute innovative methods and processes
Self-driven, confident, resourceful, and resilient
Ability to collaborate and work in partnership with different parts of the organization
WORKING CONDITIONS
Work Conditions:
This job operates in a professional office environment. This role routinely uses standard office equipment such as computers, phones, photocopiers, and filing cabinets.
Physical Conditions:
Essential and marginal functions may require maintaining physical condition necessary for sitting for prolonged periods of time, etc.
To perform this job successfully, an individual must be able to perform each essential duty satisfactorily. Reasonable accommodations may be made to enable individuals with disabilities to perform the essential functions. To request an accommodation, please contact Human Resources at (303) 792-8899 or email: HR@ncm.com.
****Out-of-market applicants are welcome. Please be advised that NCM does not pay any relocation expenses****
SALARY RANGE & BENEFIT OPTIONS FOR NEW YORK APPLICANTS:
Salary Range: Base Salary of approximately $65,000-$75,000 annually plus bonus - compensation is commensurate with skills & experience.
Benefits Options:
Medical insurance with wellness reimbursement program
Dental insurance
Vision insurance
Flexible Spending Account (FSA)
Health Savings Account (HSA)
401(k) Retirement Plan
Life & Accidental Death & Dismemberment Insurance
Short and Long-Term Disability Insurance
Paid Holidays
Paid Leave (vacation, personal days and sick)
Commuter benefits
Pet insurance
This information is provided as the company's good faith and reasonable estimate of the compensation range and benefits offered for this position. The compensation offered to the successful applicant may vary based on factors including experience, skills, education, location, and other job-related reasons.",
Senior Product Data Scientist,https://www.indeed.com/rc/clk?jk=3caccdadc3aca0d9&fccid=978d9fd9799d55a8&vjs=3,PayPal,https://www.indeed.com/cmp/Paypal,"$84,500 - $204,600 a year","At PayPal (NASDAQ: PYPL), we believe that every person has the right to participate fully in the global economy. Our mission is to democratize financial services to ensure that everyone, regardless of background or economic standing, has access to affordable, convenient, and secure products and services to take control of their financial lives.
Job Description Summary: We are looking for a Senior Product Data Scientist for our P2P Product Data Science team who goes above and beyond simply providing reports and analyses. This person will help generate insights by mining PayPal’s rich data. In the process, this person will develop a deep understanding of the Consumer experience, Payments businesses, our site functionality, further strengthen their analytic, leadership, and presentation skills, and gain exposure to a wide variety of functional teams within PayPal. Experience at managing/mentoring a small team would be a plus.
Job Description:
About You
We are seeking an exceptional data science leader with a passion for data insights and relentless focus on execution:
You are curious and inquisitive: love digging into data and uncovering insights
You are hyper-analytical and intellectually honest, truly believing in data-driven decisions and communicating your ideas through storytelling
You are a highly motivated, result-oriented self-starter, enjoy working in a fast-paced environment, and can deliver successful results with minimal guidance
You are a player-coach, and are not afraid of rolling up your sleeves and jumping into details
Your day to day:
Challenge the status quo, and drive data backed decision making
Partner closely with product leaders to understand new product offerings being built and recommend the right metrics to measure the performance of those features
Identify key metrics, conduct rigorous explorative data analysis, create executive facing dashboards and build business cases that drive decision making and business prioritization
Analyze consumer product performance and health, triage issues, and provide recommendation on the best course solution and optimization
Synthesizing large volumes of data with attention to granular details and present findings and recommendations to senior-level stakeholders
Collaborate with engineering and data engineering to enable feature tracking, resolve complex data and tracking issues, and build necessary data pipelines
Define and cultivate best practices in analytics instrumentation and experimentation
Support multiple projects at the same time in a fast-paced, results-oriented environment
Mentor junior analysts on complex analyses
What do you need to bring:
At least 5 years of experience analyzing large, multi-dimensional data sets and synthesizing insights into actionable solutions
B.S. in a quantitative field, advanced degrees preferred
Fluent in SQL and at least one scripting language such as Python or R, comfortable working with large, complex, and potentially messy datasets
Understanding of statistics (e.g. hypothesis testing, statistical inference, regression) and experience designing and evaluating complex experiments
Exceptional communication skills, both written and verbal, to influence cross-functional teams
Strong interpersonal skills and experience leading cross-functional teams
Prior work experience in a product analytics space would be highly valued
A passion for problem-solving and comfort with ambiguity
PayPal is committed to fair and equitable compensation practices.
Actual Compensation is based on various factors including but not limited to work location, and relevant skills and experience.
The total compensation for this practice may include an annual performance bonus (or other incentive compensation, as applicable), equity, and medical, dental, vision, and other benefits. For more information, visit https://www.paypalbenefits.com.
The U.S. national annual pay range for this role is $84500 to $204600
Our Benefits:
At PayPal, we’re committed to building an equitable and inclusive global economy. And we can’t do this without our most important asset—you. That’s why we offer benefits to help you thrive in every stage of life. We champion your financial, physical, and mental health by offering valuable benefits and resources to help you care for the whole you.
We have great benefits including a flexible work environment, employee shares options, health and life insurance and more. To learn more about our benefits please visit https://www.paypalbenefits.com
Who We Are:
To learn more about our culture and community visit https://about.pypl.com/who-we-are/default.aspx
PayPal has remained at the forefront of the digital payment revolution for more than 20 years. By leveraging technology to make financial services and commerce more convenient, affordable, and secure, the PayPal platform is empowering more than 400 million consumers and merchants in more than 200 markets to join and thrive in the global economy. For more information, visit paypal.com.
PayPal provides equal employment opportunity (EEO) to all persons regardless of age, color, national origin, citizenship status, physical or mental disability, race, religion, creed, gender, sex, pregnancy, sexual orientation, gender identity and/or expression, genetic information, marital status, status with regard to public assistance, veteran status, or any other characteristic protected by federal, state or local law. In addition, PayPal will provide reasonable accommodations for qualified individuals with disabilities. If you are unable to submit an application because of incompatible assistive technology or a disability, please contact us at paypalglobaltalentacquisition@paypal.com.
As part of PayPal’s commitment to employees’ health and safety, we have established in-office Covid-19 protocols and requirements, based on expert guidance. Depending on location, this might include a Covid-19 vaccination requirement for any employee whose role requires them to work onsite. Employees may request reasonable accommodation based on a medical condition or religious belief that prevents them from being vaccinated.",
"Senior Data Scientist, Product Analytics",https://www.indeed.com/rc/clk?jk=f1ae416289b4c4aa&fccid=675ee465d3812bad&vjs=3,Spring Health,https://www.indeed.com/cmp/Spring-Health-1,,"Our mission: to eliminate every barrier to mental health.
Spring Health is a comprehensive mental health solution for employers and health plans. Unlike any other solution, we use clinically validated technology called Precision Mental Healthcare to pinpoint and deliver exactly what will work for each person — whether that's meditation, coaching, therapy, medication, and beyond.
Today, Spring Health equips over 800 companies, from start-ups to multinational Fortune 500 corporations, as a leading and preferred mental health service. Companies like General Mills, Guardian, Bain, and Instacart use the Spring Health platform to provide mental health services to thousands of their team members globally. We have raised over $300 million from prominent investors including Kinnevik, Tiger Global, Northzone, RRE Ventures, Rethink Impact, Work-Bench, William K Warren Foundation, SemperVirens, Able Partners, True Capital Ventures, and a strategic investor, Guardian Life Insurance. Thanks to their partnership, our current valuation has reached $2 billion.
We are looking for a Senior Data Scientist to drive analytics efforts targeted at enhancing end user experience within Spring Health's software applications. You will be embedded in a product development team focusing on member activation which ensures that Spring Health benefit-eligible employees embark on their mental health journey in the most appropriate and effective way. In this role, you will help your team to uncover and prioritize new product opportunities and make impact across the entire initiative launch cycle - from experiment and data collection design to synthesizing actionable learnings and possible next steps post-launch.
What you'll be doing day-to-day:
Participate in strategic discussions and continuous refinement of the concept for the best-in-class early mental health journey experience and member-caregiver alliance
Collaborate with product development and member marketing leads on defining key indicators of the quality of our member activation and uncovering opportunities to improve the user experience
Ideate and design A/B tests to evaluate new product features and member communications
Define product telemetry that enables seamless reporting and analysis
Build necessary data models and insightful, automated dashboards to monitor and root-cause key product metrics trends
Actively participate in prioritization and roadmapping discussions
Lean into appropriate advanced methods, from advanced experimentation techniques to causal inference and statistical modeling, for deep-dive analyses around member engagement patterns
Participate in the development of data-centric product features like search and personalized recommendations
What we expect from you:
5+ years of professional experience in a data role (data analyst, product analyst, data scientist, or similar), and at least 2 years of experience working with and defining product or growth metrics
Hands-on experience with experimentation or hypothesis testing
Previous exposure to product development/design process in the context of a software product
Proficiency with SQL and experience with Python or R
Comfort with wrangling telemetry/event logs data
Experience working with BI tools (e.g. Looker, Tableau, Metabase) and product analytics SaaS tools (e.g. Mixpanel, Amplitude, Heap, etc.)
Excellent verbal and written communication skills to guide and make recommendations to technical and non-technical business users
Proven ability to proactively manage your own priorities and dependencies in alignment with cross-functional dependencies and product/business impact in a fast-paced environment
Passion for successfully navigating ambiguous problem areas and learning new approaches
General willingness to occasionally travel (at least 1x/year) to NYC for collaborative sessions/offsites with the team
What we'd love to see (bonus):
Exposure to building and/or evaluating ML or heuristics-based recommendation algorithms, tuning search and sorting algorithms is preferred
Some level of comfort with data modeling and pipelining via dbt or similar tools
The target salary range for this position is $159,100 - $194,150, and is part of a competitive total rewards package including stock options, benefits, and incentive pay for eligible roles. Individual pay may vary from the target range and is determined by a number of factors including experience, location, internal pay equity, and other relevant business considerations. We review all employee pay and compensation programs annually at minimum to ensure competitive and fair pay.
Don't meet every requirement? Studies have shown that women, communities of color and historically underrepresented talent are less likely to apply to jobs unless they meet every single qualification. At Spring Health we are dedicated to building a diverse, inclusive and authentic workplace, so if you're excited about this role but your past experience doesn't align perfectly with every qualification in the job description, we strongly encourage you to apply. You may be just the right candidate for this or other roles!
Ready to do the most impactful work of your life? Learn more about our values, how we work, and how hypergrowth meets impact at Spring Health: Our Values
Hypergrowth meets impact
What to expect working here:
You will be held accountable to an exceptionally high bar and impact
This may be the fastest work environment you will ever experience in terms of growth, decision-making, and time to impact
You will be challenged to set and protect your own boundaries
You will create processes & products that have never existed before
You will have very direct conversations and receive continuous feedback to push you to become the highest performer you can be
Change is a constant here: your role, team, responsibilities, and success metrics will shift as the company grows
And…
You get to be surrounded by some of the brightest minds in the field
You get to learn and grow at an extremely accelerated pace
You will experience transparency, integrity, & humility from leadership
You will be empowered to constantly challenge the status quo
You get the space to experiment & innovate
You get to make a transformational impact for the company, mental health, and for real human lives — and you will see that impact quickly
You will become more resourceful and resilient
You get to be part of a winning team that opens doors in the future
Benefits provided by Spring Health:
Focus on total health including:
Generous medical, dental, vision coverage available day 1 + access to One Medical
20 total yearly no-cost visits to the Spring Health network of therapists, coaches, and medication management providers for you and your dependents
Flexible paid time off in addition to 12 paid holidays throughout the year
$500 per year Wellness Reimbursement
Spring Health provides access to QuitGenius, a platform with technology-tailored, personalized addiction treatment plans for substance use (*QG is available to benefit-enrolled employees, spouses, and dependents age 18+)
Supporting you and your family:
4-4.5 months of fully paid parental leave
Spring Health provides team members and their families with sponsored access to Bright Horizons® child care, back-up care, and elder care.
Access to Joshin is provided by Spring Health. Joshin is a comprehensive support system for disabilities and neurodivergence in the workplace. This benefit supports employees, their families, and our teams through personalized navigation and disability education and training along with a network of screened in-home caregivers with disability and neurodivergent experience.
Supporting you financially through:
Our People team benchmarks all salaries using the Radford Global Compensation Database for technology and life sciences industries. Radford benchmarks salaries with 3,589 global firms, 6.5 million employees, and 98 countries across the globe. We do this to ensure all of our team members are paid equally and competitively.
On top of competitive and benchmarked salary, Spring Health offers incentive pay (based on role), and equity that begins vesting as we celebrate your first year with the company!
Employer sponsored 401(k) match of up to 2% after 90 days of employment
Creating a culture you can thrive in:
Flexible work arrangements: 60% of Spring Health team members work fully remote while 40% work in a hybrid model from our New York City offices
Calm Fridays: no meetings, no distractions, just time for you to get work done.
Up to $1,000 Professional Development Reimbursement per calendar year. Any requests over $250 must be requested for pre-approval prior to enrollment by sending an email to the People Team.
$200 per year donation matching to support your favorite causes
Our privacy policy: https://springhealth.com/privacy-policy/
Spring Health is proud to be an equal opportunity employer. We do not discriminate in hiring or any employment decision based on race, color, religion, national origin, age, sex, marital status, ancestry, disability, genetic information, veteran status, gender identity or expression, sexual orientation, or other applicable legally protected characteristic. We also consider qualified applicants regardless of criminal histories, consistent with applicable legal requirements. Spring Health is also committed to providing reasonable accommodations for qualified individuals with disabilities and disabled veterans. If you have a disability or special need that requires accommodation, please let us know.",
