Job Title,Job_url,Company Name,Company_url,_Salary,Job_Description,Location
Staff Data Engineer,https://www.indeed.com/rc/clk?jk=850492e35c23ee76&fccid=c8e07f37dc242ad2&vjs=3,,,"$160,000 - $275,000 a year","About Entera
Entera is the leading SaaS and Services platform for Enterprise and Mid-Market Single Family Investors, empowering them to buy, sell and operate their real estate investments, seamlessly. Powered by Artificial Intelligence (AI), Entera's online marketplace offers the best combination of data, technology, services and expertise to real estate investors. Since its inception in 2018, Entera has transacted on 15,000+ single family homes valued at $4.5B across 29 US markets. Backed by leading investors Goldman Sachs, Bullpen, and Craft, Entera is helping its clients access, evaluate and transact on over 350,000 properties, scale their operations, make strategic data-driven decisions, and win more often. The company is headquartered in New York City, New York and Houston, Texas.
Importance of Data at Entera
At Entera, data is what drives us and is one of our core critical assets. Our customers depend on Entera because the combination of insights we generate and the data that we provide are not available anywhere else. We are creating a new space at the intersection of FinTech and PropertyTech.
We are proud of the data infrastructure and systems we have built to date – which have contributed to our company's successes. There is so much more to build and we are looking for the right person who lives and breathes data to come join our team. Our stack includes Snowflake, Prefect, dbt, Airbyte, and Superset, to name a few. Our data engineering work is primarily in Python and SQL, while our partners on the application side operate primarily in Ruby and JavaScript.
The Role:
As a Staff Data Engineer, you will lead the charge in the designing and building of the next iteration of our data ecosystem. As a central leader on the team, you will not only contribute to a world-class data ecosystem and a strong data-driven culture, but also be a key mentor and coach to other engineers and analysts at Entera.
What You'll Do:
System Architecture: Design and lead the creation of our next generation data ecosystem, in a way that supports our clients' needs as well as our internal data science and analytics efforts
ETL & Data Modeling: Design tables and ETL workflows with a focus on both speed and trustworthiness of the data that will feed our products and our internal BI reporting
Coach the Team: Elevate the level of the entire Data Team by establishing best practices in coding, security, and data wrangling; coaching others on the Data Team through various activities such as paired-programming, mentoring, hosting lunch and learns, etc.
Establish and Improve KPIs: Help set meaningful SLOs (Service-Level Objectives) and lead the team in achieving them
Represent the company as a technical speaker: We have plenty of opportunities – whether at local meetups or larger conferences – to showcase our talents and share our journey in building our ecosystem
Be a thought-leader and partner to our stakeholders: You'll partner with multi-disciplinary experts throughout the company to help decide where to best focus our efforts and resources, and to envision the future of our product offerings
Grow with us: At Entera, you'll be able to further develop and hone your skills and receive ample support for your continued growth
Raise the bar: Help to define and improve our internal standards for style, maintainability, and best practices for a high-scale data infrastructure
Who You Are:
7+ years hands-on experience in leadership in Data Engineering, with 4+ years at a growing, product-driven tech company
Built and implemented several data warehouses in, both, AWS and GCP
Intimately familiar with Prefect and/or Airflow
Highly proficient in security best practices
Able to teach advanced level Python and SQL
Carry strong opinions in what makes for great code, and able to articulate to folks of various technical capabilities the reasoning behind these preferences
Enjoy public speaking and discussing you and your team's work
Experienced in implementing highly-effective CI/CD pipelines consisting of multiple environments
Able to break down complex projects into small chunks, and help to identify how to best distribute the workload across the team
Operate at the cutting edge of technology, with the ability to discern what tools are worth implementing while not getting charmed by ""shiny new objects""
Strong knowledge in DevOps, including hands on experience with Kubernetes, Docker, & Terraform (or similar)
Nice to haves:
Understanding of distributed compute frameworks like Spark or Dask
Professional experience and/or personal interest in FinTech, Real Estate, and/or PropTech
Experience with NoSQL / document-store databases
Experience productionalizing Machine Learning models
For those applicants in the NYC area, the salary range for this role is $160,000 to $275,000 plus an annual bonus. The salary offered will be based on experience, role, and location.
Entera is proud to be an equal opportunity employer (EEO) that celebrates difference and diversity. We are committed to equal employment opportunity regardless of race, color, ancestry, religion, sex, national origin, sexual orientation, age, citizenship, marital status, disability, gender identity or Veteran status. We are committed to building an inclusive work environment where all employees feel a sense of belonging and respect. If there is anything we can do to ensure you have a comfortable and positive interview experience, please let us know.",
Bionics Initiative - Data Scientist Director,https://www.indeed.com/rc/clk?jk=27a37443aa592c4b&fccid=aaf3b433897ea465&vjs=3,"JPMorgan Chase Bank, N.A.",https://www.indeed.com/cmp/Chase-2,"$161,500 - $275,000 a year","Data is our competitive advantage. The Small Business - Bionics team is all about giving the superpower of data to our bankers, clients and executives, and change the way decisions are made. If you have a startup mindset, and truly believe in the power of data and AI, this role is for you.
Job responsibilities
Understand deeply the needs of our bankers, the jobs to be done and how our intelligence (present our future) can better serve them
Relentlessly prioritizing key developments and functionalities, with a focus on value and impact
Ensure adoption and optimal impact, through training, best practices, and internal communication more broadly
Develop the tools for our data to feed these different use cases
Be an internal entrepreneur, influence our stakeholders and find innovative ways to have impact. Cultivate a network within a company, understand where our intelligence adds value
Partner with other stakeholders to build and productionalize client and industry data, as well as consumption layers
Enable the management of data as a corporate asset: define data (metadata), identify systems of record and authoritative sources, create data quality rules, define security requirements, create data flow diagrams, and administer firm-wide principles, standards, and controls
Required qualifications, capabilities and skills
PhD or MSc. in a scientific field (Mathematics, Physics, Computer Science, Engineering, etc.)
10+ years of Financial Services technology experience
5+ years of management experience
Product Management expertise
Proficient in big data platform and its applications, such as Python, SQL, Pig, Hive, and Spark
Experience in leveraging AI/ML/Advanced Analytics with actual impact
Preferred qualifications, capabilities and skills
Ability to move quickly and embrace an experiment-driven product development approach.
Understanding and prior experience in Ontology and Taxonomy mapping.
Conduct user research to identify pain points and inform design.
CCB Data Analytics
Chase is a leading financial services firm, helping nearly half of America's households and small businesses achieve their financial goals through a broad range of financial products. Our mission is to create engaged, lifelong relationships and put our customers at the heart of everything we do. We also help small businesses, nonprofits and cities grow, delivering solutions to solve all their financial needs.
We recognize that our people are our strength and the diverse talents they bring to our global workforce are directly linked to our success. We are an equal opportunity employer and place a high value on diversity and inclusion at our company. We do not discriminate on the basis of any protected attribute, including race, religion, color, national origin, gender, sexual orientation, gender identity, gender expression, age, marital or veteran status, pregnancy or disability, or any other basis protected under applicable law. In accordance with applicable law, we make reasonable accommodations for applicants' and employees' religious practices and beliefs, as well as any mental health or physical disability needs.
The health and safety of our colleagues, candidates, clients and communities has been a top priority in light of the COVID-19 pandemic. JPMorgan Chase was awarded the ""WELL Health-Safety Rating"" for all of our 6,200 locations globally based on our operational policies, maintenance protocols, stakeholder engagement and emergency plans to address a post-COVID-19 environment.
As a part of our commitment to health and safety, we have implemented various COVID-related health and safety requirements for our workforce. Employees are expected to follow the Firm's current COVID-19 or other infectious disease health and safety requirements, including local requirements. Requirements include sharing information including your vaccine card in the firm's vaccine record tool, and may include mask wearing. Requirements may change in the future with the evolving public health landscape. JPMorgan Chase will consider accommodation requests as required by applicable law.
We offer a competitive total rewards package including base salary determined based on the role, experience, skill set, and location. For those in eligible roles, discretionary incentive compensation which may be awarded in recognition of individual achievements and contributions. We also offer a range of benefits and programs to meet employee needs, based on eligibility. These benefits include comprehensive health care coverage, on-site health and wellness centers, a retirement savings plan, backup childcare, tuition reimbursement, mental health support, financial coaching and more. Additional details about total compensation and benefits will be provided during the hiring process.
Equal Opportunity Employer/Disability/Veterans
Base Pay/Salary
New York,NY $161,500.00 - $275,000.00 / year",
Data Scientist,https://www.indeed.com/rc/clk?jk=78fbbf5409f818f8&fccid=ada833cd00ae27d8&vjs=3,FanDuel,https://www.indeed.com/cmp/Fanduel,"$102,000 - $128,000 a year","ABOUT FANDUEL GROUP
FanDuel Group is a world-class team of brands and products all built with one goal in mind — to give fans new and innovative ways to interact with their favorite games, sports, teams, and leagues. That's no easy task, which is why we're so dedicated to building a winning team. And make no mistake, we are here to win, but we believe in winning right. That means we'll never compromise when it comes to looking out for our teammates. From our many opportunities for professional development to our generous insurance and paid leave policies, we're committed to making sure our employees get as much out of FanDuel as we ask them to give.
Our brands include:
FanDuel — A game-changing real-money fantasy sports app
FanDuel Sportsbook — America's #1 sports betting app
FanDuel TV — ""The Bettor Sports Network"" bringing live sports and interactive content to the games fans care about most
FanDuel Racing — A horse racing app built for the average sports fan
FanDuel Casino & Betfair Casino — Fan-favorite online casino apps
FOXBet — A world-class betting platform and affiliate of FanDuel Group
PokerStars — The premier online poker product and affiliate of FanDuel Group
THE POSITION:
Our roster has an opening with your name on it
We are looking for a Data Scientist for our Sports Modeling & Innovation team to tackle our most challenging sports modeling problems. Throughout the lifecycle of a model, from data collection through results, you will create predictive models of sports to build tools and dashboards, price markets, and drive actionable insights across FanDuel Group. You will be working closely with the product and risk and trading teams, modeling player performance, team performance, and game outcomes among other challenges You will promote effective communication of model outputs and contribute to a collaborative code environment.
THE GAME PLAN:
Everyone on our team has a part to play
Develop, iterate, and take to production machine learning models to predict sports outcomes and solve problems
Iterate and improve on betting product range to ensure market leading offering
Continuous improvement in pricing techniques - both at an individual level and working with trading teams to optimize predictive and derivative model pricing
Choose appropriate tools, systems and models to solve large data problems
Troubleshoot and resolve coding and modeling problems presented by others
Proactively seek opportunities or problems to be analyzed
Lead and contribute to multiple strategic projects
Contribute to group strategy, ensuring they reflect priorities for your team and stakeholders
Put together project plans for the Data Science team to follow
Presents to senior leaders confidently and with impact
Construct models, analyses and solutions in response to a question or problem posed by a stakeholder or colleague
Provide data-driven recommendations to stakeholders, articulating complex technical concepts as necessary
Manage the data preparation process from collection through cleaning
Engage with engineering to build scalable tools to accelerate the conversion of data to insight
Build robust predictive models, showing capabilities of feature and model selection
Work with decision-makers across the company to understand their goals, identify opportunities to use data to develop new insights and improve business results
Bring efficiency and automation in the data infrastructure
Create dashboards and data visualizations for analysis and communication
Opportunity to mentor and or coach more junior data scientists
Communicate process and conclusions seamlessly, tailored to the audience
THE STATS:
What we're looking for in our next teammate
A minimum of 1 year of Industry Experience in data science, analytics or engineering preferred
Bachelor's Degree in a highly numerate major (Math, Stats, Econ, etc.) or relevant experience in data science preferred
Strong analytical and quantitative skills, with high proficiency in Python or R, and SQL
Understanding and application of Bayesian statistics
Experience building and using models to help create production level products and tools
Comfortable with command line tools and GitHub
Object-oriented design and coding skills
Strong verbal and written communication skills
Ability to work across teams, locations and time zones
Interest or experience in Sports Gaming and/or Fantasy Sports
THE CONTRACT:
We treat our team right
Competitive compensation is just the beginning. As part of our team, you can expect:
An exciting and fun environment committed to driving real growth
Opportunities to build really cool products that fans love
Mentorship and professional development resources to help you refine your game
Flexible vacation allowance to let you refuel
Hall of Fame benefit programs and platforms
The applicable salary range for this position is $102,000 to $128,000, which is dependent on a variety of factors including relevant experience, location, business needs and market demand. This role may offer the following benefits: medical, vision, and dental insurance; life insurance; disability insurance; a 401(k) matching program; among other employee benefits. This role may also be eligible for short-term or long-term incentive compensation, including, but not limited to, cash bonuses and stock program participation.
This role includes flexible time off (including unlimited paid time off for full-time employees) and 13 paid company holidays. FanDuel offers paid sick time in accordance with all applicable state and federal laws.
FanDuel Group is an equal opportunities employer. Diversity and inclusion in FanDuel means that we respect and value everyone as individuals. We don't tolerate bias, judgement or harassment. Our focus is on developing employees so that they reach their full potential.
#LI-Hybrid",
Create Sales Workflows Using Artificial Intelligence Programs,https://www.indeed.com/company/Zoom-Capital-Inc/jobs/Create-Sales-Workflow-Using-Artificial-Intelligence-Program-fb4b561ad62026fe?fccid=eb3a53bc4b484f0c&vjs=3,,,$25 an hour,Work Location: In person,
"Data Scientist, Product Analytics",https://www.indeed.com/rc/clk?jk=aef6baf067107234&fccid=8899ecbdba2d0a5e&vjs=3,Peloton,https://www.indeed.com/cmp/Peloton,"$136,300 a year","ABOUT THE ROLE
Interested in driving business and product strategy? If yes, this role will work within the EE-commerce Product Team to better understand how members are interacting with our E-commerce Platform, and inform and evaluate new features and experiences developed by the software teams. This is an advanced analytics role where you will apply various predictive and statistical modeling techniques to solve complex multi-faceted problems, assist in defining metrics and KPIs, design experiments to validate hypotheses, help scale our measurement techniques, drive personalization strategy, translate complex findings and results into a compelling narrative, and manifest it into product changes.
YOUR DAILY IMPACT AT PELOTON:
Drive innovation by developing new experimentation methodologies, evaluating the impact of new features, and providing advanced data analysis using statistical modeling techniques such as regression, classification, clustering, and causal-inference approaches that help sharpen our product decision-making process.
When necessary, build models in R/Python, or other systems that help us better measure and understand the results of experiments or user flows, automate data pipelines to scale experimentation, facilitate product analysis and improve product analytics infrastructure.
Own analytics within several product development work streams from KPI definition and data instrumentation design to ongoing reporting, deep-dive and generative research
Develop data-driven business insights to help make better decisions that power our Ecommerce business by partnering with Product, Engineering, Design, cross functional teams and leadership to drive maximum business impact.
During feature definition, help define success metrics and design event-based analytics implementation by working with Engineering. Post-launch evaluate the feature using these analytics and collaborate with Product Managers to inform subsequent feature iterations.
Design, Implement and evaluate A/B tests with championing best practice experimentation methodologies to optimize customer journeyson the Web.
WHAT YOU BRING TO PELOTON:
Have 3+ years of work experience in data-driven analytics/predictive analytics/statistical modeling. Product analytics experience with a B2C or e-commerce business is a plus
Have 2+ years of experience with A/B testing and Experimentation
Experience with manipulating large datasets using SQL (including complex joins, CTE, query optimization) and with statistical programming software such as Python or R, in combination with visualization packages for Exploratory Data Analyses and to communicate results of analyses.
Have strong experience in statistics and data science methodologies (e.g. data modeling, hypothesis testing, regressions, machine learning) along with Causal Inference methodologies like propensity score matching, etc
Have hands-on experience with various elements of the product analysis pipeline, such as:
Formulating and testing hypotheses
Identifying and communicating data requirements for analytics projects
Extracting and cleaning up large data sets
Analyzing data using a variety of tools
Synthesizing and presenting results to stakeholders of various seniority levels and professional backgrounds
Have the ability to work collaboratively in a team environment
Excellent verbal and written communication, attention to detail, and presentation skills to be able to efficiently communicate complicated analyses to non-technical team members!
AS A BONUS:
Knowledge and experience working in agile/scrum product development
Proficiency in working with Segment, Amplitude, in one or more analytics & visualization tools (e.g. Chartio, Looker, Tableau)
Experience with statistical and machine learning methods to build descriptive and predictive models
Experience in and/or passion for health and fitness, sports, gaming, or other related fields
Base Salary: $136,300.00.00 to $156,800.00.00
The base salary range represents the low and high end of the anticipated salary range for this position based at our New York City headquarters. The actual base salary offered for this position will depend on numerous factors including individual performance, business objectives, and if the location for the job changes. Our base salary is just one component of Peloton's competitive total rewards strategy that also includes annual equity awards and an Employee Stock Purchase Plan as well as other region-specific health and welfare benefits.
#LI-CS3
ABOUT PELOTON:
Peloton is the leading interactive fitness platform globally, with a passionate community of nearly 7 million Members in the US, UK, Canada, Germany, and Australia. Peloton makes fitness entertaining, approachable, effective, and convenient, while fostering social connections that motivate its Members to commit to their fitness journeys. An innovator at the nexus of fitness, technology, and media, Peloton reinvented the fitness industry by developing a first-of-its-kind subscription platform that seamlessly combines the best equipment, proprietary networked software, world-class streaming digital fitness and wellness content, and best-in-class fitness experts and Instructors.
Peloton is an equal opportunity employer and committed to creating an inclusive environment for all of our applicants. We do not discriminate based upon race, religion, color, national origin, gender (including pregnancy, childbirth, or related medical conditions), sexual orientation, gender identity, gender expression, age, status as a protected veteran, status as an individual with a disability, or other applicable legally protected characteristics. If you would like to request any accommodations from application through to interview, please email: applicantaccommodations@onepeloton.com
Please be aware that fictitious job openings, consulting engagements, solicitations, or employment offers may be circulated on the Internet in an attempt to obtain privileged information, or to induce you to pay a fee for services related to recruitment or training. Peloton does NOT charge any application, processing, or training fee at any stage of the recruitment or hiring process. All genuine job openings will be posted here on our careers page and all communications from the Peloton recruiting team and/or hiring managers will be from an @onepeloton.com email address.
If you have any doubts about the authenticity of an email, letter or telephone communication purportedly from, for, or on behalf of Peloton, please email applicantaccommodations@onepeloton.com before taking any further action in relation to the correspondence.
Peloton does not accept unsolicited agency resumes. Agencies should not forward resumes to our jobs alias, Peloton employees or any other organization location. Peloton is not responsible for any agency fees related to unsolicited resumes.",
